,title,score,id,url,comms_num,created,body
0,"You have been accepted for an experiment: you must stay in a room with nothing but bed/toilet/food/water and no human contact for one month. If you succeed for the whole month without giving up, you get $5,000,000. Do you accept? And what are your coping strategies to avoid mental breakdown?",82600,87wckw,https://www.reddit.com/r/AskReddit/comments/87wckw/you_have_been_accepted_for_an_experiment_you_must/,22162,1522277527.0,
1,What healthy food tastes just as good as unhealthy food?,76417,f1citv,https://www.reddit.com/r/AskReddit/comments/f1citv/what_healthy_food_tastes_just_as_good_as/,22068,1581272089.0,
2,"Fast food workers, what is your ""Sir, this is a Wendy's"" moment?",76212,imr79a,https://www.reddit.com/r/AskReddit/comments/imr79a/fast_food_workers_what_is_your_sir_this_is_a/,15348,1599263884.0,
3,What food do you swear people only pretend to like?,76039,jm76w8,https://www.reddit.com/r/AskReddit/comments/jm76w8/what_food_do_you_swear_people_only_pretend_to_like/,44093,1604255262.0,
4,What foods can a teenager cook for his parents to help their depression?,75707,b53fvi,https://www.reddit.com/r/AskReddit/comments/b53fvi/what_foods_can_a_teenager_cook_for_his_parents_to/,5183,1553471838.0,
5,What food does your mom make better than anybody who has ever existed in the history of the universe?,70099,l5el4d,https://www.reddit.com/r/AskReddit/comments/l5el4d/what_food_does_your_mom_make_better_than_anybody/,23865,1611669755.0,
